Title,Date,Text
Is Trump’s near-death experience part of God’s plan?,7-16-2024,"Extreme, unusual events — all it takes is one — can change the trajectory of individual lives and entire nations. Although we didn’t know it yet, America had just days ago two potential futures — one in which Donald Trump was shot and one in which he wasn’t. Trump’s history of pettiness, demagoguery and sheer narcissism is so long and consistent that it seems a fantasy that he might ever change and put his country over his own wants and desires. But it is worth fantasizing for a moment. Perhaps Trump is doing the same. Less than 24 hours after the bullet grazed his ear, he told reporters that he had a “brutal” speech ready for the Republican National Convention but “threw it out” in favor of something more unifying. Displaying an unusual level of self-awareness, he explained: “I think it would be very bad if I got up and started going wild about how horrible everybody is and how corrupt and crooked, even if it’s true.” Knowing what we know now, the Trump rally in Butler, Pa., is striking to watch. A moment before shots ring out, the former president turns his head. It’s a turn that changes American history. A brush with death has — at least temporarily — ushered in a more reflective Trump. Bluster is replaced by an appreciation of luck, chance and his own mortality: “If I only half-turn, it hits the back of the brain,” he said. “The other way goes right through [the skull]. ... The chances of my making a perfect turn are probably one-tenth of 1 percent. And his conclusion: “I’m not supposed to be here.” Stories of near-death experiences chastening sinners and pushing them toward the light are the stuff of legend. But
they are also the stuff of real, ordinary lives — of individuals who make a conscious choice to turn away from the past
and restructure their own narratives toward a better end.
Foiled assassination attempts are their own subgenre, and here the evidence is more mixed. Egyptian relatives of
mine noted the similarities between the attack on Trump and a plot on Egyptian strongman Gamal Abdel Nasser in
October 1954. A gunman fired at him during a speech but missed. Seconds later, Nasser was defiant and electrified
the crowd in one of the more emotional political moments caught on tape. “I will live for your sake and die for the
sake of your freedom and honor,” he said, his voice rising. “Let them kill me; it does not concern me so long as I have
instilled pride, honor and freedom in you.” Sadly, the aftermath did not quite follow in that spirit. Nasser ordered
one of the most extensive political crackdowns in Egypt’s history and nurtured a personality cult that would remain
until his death 16 years later.
In 2016, Turkish President Recep Tayyip Erdogan survived a dramatic coup attempt. The plotters came close to
killing him, firing on his location in the resort town of Marmaris, Turkey, shortly after he had left. Afterward,
Erdogan called the coup attempt a “gift from God.” He responded to the gift with escalating repression, leaning into
his authoritarian instincts with renewed vigor.
Failed assassination attempts on actual or would-be heads of state are, mercifully, less common in established
democracies. For a similarly close call in the United States, one must go back to March 30, 1981, when John
Hinckley Jr. shot and nearly killed President Ronald Reagan. “I was lucky,” Reagan recalled. “The bullet that hit me
bounced off a rib and lodged in my lung, an inch from my heart.”
Reagan, too, considered this part of God’s divine plan. On his hospital bed, Reagan, who wasn’t an especially devout
man, prayed to God for help but also “began to pray for his [shooter’s] soul and that he would find his way back into
the fold.” Back at the White House, Reagan told Cardinal Terence Cooke: “I have decided that whatever time I have
left is for Him.” His encounter with death also had implications for the policies he pursued in the twilight of the Cold
War. As he later recounted, “Perhaps having come so close to death made me feel I should do whatever I could in the
years God had given me to reduce the threat of nuclear war.”
Trump is not Reagan. He is, well, Trump. But if God is real — something that most Americans still believe — then
presumably no one is immune to his gifts. The question then remains: What will Trump choose to do with his? Not
known for speaking about the divine with real feeling or sincerity, he has been quick to praise God, saying that “it
was God alone who prevented the unthinkable from happening.” The Trump family is feeling “spiritual, in a way,”
according to a person close to them. Of course, a change of Trump’s heart would not mean he would pursue policies that Democrats like. He is still the
nominee of the Republican Party. But it could mean that he campaigns and then governs — in the now more likely
event that he wins — in a manner that is less authoritarian. It could mean that when presented with an opportunity
to escalate tensions, he might choose instead to tamp them down. As it happens, this would also be in his selfinterest, a way to redeem is tarnished legacy.
If this sounds like a fantasy, perhaps it is. But fantasies sometimes come true. Fortunately for Trump — and perhaps
for us — God works in mysterious ways."
Trump has changed what it means to be evangelical,6-17-2024,"Despite an effort to overthrow an election and a bevy of criminal charges, Donald Trump has managed to solidify and even expand his support among core demographics. It remains the eternal Trump question: Who are his supporters and why are they so devoted to him?

Sign up for Shifts, an illustrated newsletter series about the future of work
The voters most loyal to the former president are White evangelicals. More than 80 percent backed him in the 2020 elections. And this has long presented a puzzle: How can people who prize moral rectitude and personal witness to Jesus so faithfully support the most secular president in American history, someone who seems by his behavior at best indifferent to Christianity?

Part of the answer is that Trump has been able to change the meaning of “evangelical.” This is no small feat.

It is easy to forget it now, but evangelicals initially were skeptical of Trump. During the 2016 Republican primaries, Sen. Ted Cruz (Tex.) was the preferred choice of churchgoing evangelicals, while Trump’s strongest support came from evangelicals with lower levels of church attendance. During the primary campaign, when one influential Christian magazine surveyed 100 evangelical leaders, not a single one said they planned to vote for Trump.

ADVERTISING


But Trump’s awkward relationship with evangelicals grew stronger. At first, it was transactional, a question of power. He was the Republican candidate, and the vast majority of White evangelicals were Republicans. He promised them policy victories and delivered on appointing the staunchly conservative Supreme Court justices who would overturn Roe v. Wade. And it wasn’t just that. As American culture became more secular and progressive on social issues, White evangelicals perceived themselves as under attack. Trump said he would protect them. He would fight not just for their preferred policies but for their very identities.


Follow Shadi Hamid

Follow
After evangelicals embraced Trump, something odd happened. As other Christian denominations hemorrhaged members, evangelicals saw their ranks grow; from 2016 to 2020, their share of the White adult population increased to 29 percent, from 25 percent, according to the Pew Research Center. The catch was many of these new evangelicals didn’t go to church. They became evangelicals because of what it meant politically, most of all because it was a way to signal support for Donald Trump. Among White Trump supporters who were not evangelicals in 2016, 16 percent began to identify as evangelical by 2020, suggesting again that politics rather than religion was the driving factor.
The idea of evangelicals who don’t go to church was once unusual. Now, it is surprisingly common. In 2008, only 16 percent of evangelicals said they never or seldom attended church. By 2020, 27 percent did.

Evangelicalism, in short, has become about shared political convictions. In one survey of Christian attitudes, for example, 43 percent of evangelicals said they did not believe in the divinity of Christ. But it gets even more bizarre. According to the 2022 Cooperative Election Study, 14 percent of Muslims (and 12 percent of Hindus and 5 percent of Jews) described themselves as “born-again” or evangelical Christians. This is not a joke.

If we look more closely at the numbers, what’s happening becomes clearer — and it’s fascinating. About three times more Republican Muslims and Republican Jews identify as “evangelical” than their Democratic counterparts, according to an analysis of the data by political scientist Ryan Burge. In an America that is rapidly secularizing — in just two decades, church membership has plummeted to under 50 percent, from about 70 percent — partisan commitments are replacing religious affiliation as people’s overarching source of identity.

This has unsettling implications for U.S. politics and the presidential campaign to come. It means we will see more intense political polarization around religion. Now that White evangelicals are so disproportionally and unapologetically Trump-supporting, the share of Democrats who view Christianity negatively is likely to remain high or perhaps even increase.


Democrats have had many opportunities to stem these shifts. They could have done more — and still can — but haven’t. In the pre-Trump era, Democratic presidential candidates took seriously the task of reaching out to devout Christians and presenting their party as hospitable to people of faith. The Hillary Clinton campaign, on the other hand, made a conscious decision to de-prioritize outreach to evangelicals. As Michael Wear, Barack Obama’s faith outreach director in 2012, put it, “The simple difference between Obama’s two presidential campaigns and Clinton’s 2016 campaign is that Obama asked for the votes of White evangelicals and Clinton did not.”

The transformation of American evangelicals has been a long time coming. In 1990, 40 percent of White evangelicals were Democrats. Today, this share is closer to 15 percent. As Burge told me, Democrats don’t want to alienate the rising number of nonreligious Americans who make up their ranks, so “they don’t talk about religion very much, or in a compelling way. And they sort of just ceded the ground.” This is the ground that Trump took up — a perfectly imperfect vessel for an uncertain age.

Americans are becoming less religious, but more of them are becoming evangelicals — or at least claiming the label as a badge of partisan identity. Trump’s ability to turn out evangelicals, both religious and nonreligious — including the growing ranks of Muslim, Jewish and Hindu “evangelicals” — to the same overwhelming degree that he did in 2020 could very well decide a close race. Religion matters, even when it’s not really about religion."
How Israel and the United States suppress democracy in the Middle East,5-13-2024,"The Middle East has a way of confounding American leaders and undermining legacies. Just eight days before Hamas’s Oct. 7 assault on Israel, national security adviser Jake Sullivan noted with satisfaction that “the Middle East region is quieter today than it has been in two decades.” Two weeks before the fall of Egyptian strongman Hosni Mubarak in the early days of the Arab Spring, Secretary of State Hillary Clinton declared, “Our assessment is that the Egyptian government is stable.” Perhaps most infamously, on New Year’s Eve in 1977, President Jimmy Carter called the Shah Mohammad Reza Pahlavi’s dictatorship in Iran an “island of stability.” Nine days later, the first small rally in the Iranian Revolution took place. The rallies didn’t stay small for long.

Apparently, the lesson must be relearned at regular intervals. The Middle East never stays quiet. Yet the illusion that it can leads American presidents along misguided, even dangerous paths. At the start of President Biden’s tenure, Gaza had been quiet. The Middle East as a whole had been (relatively) quiet. But its problems were festering.

Sign up for Democracy, Refreshed, a newsletter series on how to renovate the republic.
Successive U.S. administrations have longed to pivot to Asia. They have viewed the Middle East as a distraction, a mess to be contained so that the adults in the room can focus on things that matter more. President Barack Obama was known to privately joke, “All I need in the Middle East is a few smart autocrats.” He also wondered out loud why everyone couldn’t just “be like the Scandinavians.”


Scandinavians, of course, don’t live under repressive regimes, backed and armed with billions of dollars’ worth of U.S. economic and military aid. The question of why the Middle East is so dysfunctional, despite considerable American attention and investment, is a complicated one, immortalized in the titular prompt of Bernard Lewis’s “What Went Wrong?”


Follow Shadi Hamid

Follow
In the early, heady days of the Arab Spring, things finally seemed to be going right. For decades, something known as “linkage theory” — which asserts that the Arab-Israeli conflict must be resolved for the region to progress on other fronts — had dominated discussions about the Middle East. The promise of the Arab uprisings seemed to confirm the absurdity of focusing on Israel’s role. Protesters might have cared about Israel, but they cared more about their own governments, and apparently they could topple them, with or without regional peace.

Back then, I, too, thought Israel didn’t matter much. But I was wrong.


Today, Israel stands at the center of a region the United States helped form. The decision to elevate Israel’s security interests above almost everything else, however well-intentioned, has distorted American policy. Even though it is the region’s only established democracy, Israel is a staunch opponent of democracy in the rest of the Middle East.

The reason for this is simple enough: Arab populations tend to be doggedly anti-Israel. If they were to vote, they would elect leaders who reflected their sentiments. Elected governments that were independent, strong and proud — not American client states, in other words — would have to take a stronger position in support of Palestinian rights and statehood. Compare this with the Middle East’s current situation. Despite the death toll and sheer destruction in Gaza, Arab regimes have restricted public dissent. They have tried their best to keep things quiet — there’s that word again. For Israel, this is a virtue.

That Israel prefers autocrats over democrats has been a source of tension with the United States. Most of the more than 20 senior George W. Bush and Obama administration officials I interviewed for my book “The Problem of Democracy” recounted Israeli officials’ irritation whenever the United States would flirt with taking a more forthright pro-democracy stance in the region. Elliott Abrams, a deputy national security adviser under Bush, described the tenor of disagreement during the time of Bush’s so-called Freedom Agenda, from 2003 to 2005: “It was mockery behind our backs. They’d say, ‘You don’t understand at all. You know nothing about Arabs.’ … Because their argument was, ‘You will see who wins. The bad guys are gonna win. The Islamists are going to win victory after victory if you open these systems up.’”
A senior member of the Obama White House, referring to Egyptian Gen. Abdel Fatah El-Sisi’s coup against a democratically elected Islamist government in 2013, said “the strongest lobbying I got for going easier on Sisi was from Israel.”

If you privilege Israel’s dominance in the region above other considerations, then the price — the indefinite subjugation of hundreds of millions of Arabs — might be worth it. If you’re an Israeli, after the horrors of Oct. 7, it might even be a trivial consideration. For most of us, however, a moral and strategic reckoning is overdue.

The promise of authoritarian stability is false. Authoritarian regimes only seem stable — until they’re not. They are fierce but brittle, and that brittleness becomes obvious only after the fact. Michael McFaul, former U.S. ambassador to Russia, captures this dynamic well when he says, “The longer a democratic regime survives, the less likely it will collapse. … The longer an autocracy survives, the more likely it will collapse.”

Like administrations before it, Biden’s conflates quiet with stability. While stability suggests consistency and predictability, quiet is what it sounds like before a storm. After the storm passes, it will be up to anyone who cares about the Middle East — and the many who don’t — to resist the temptation to repeat old mistakes. If the status quo seems untenable, it’s probably because it is.


"
Why it matters that some Democrats voted against aid for Israel,4-21-2024,"Americans have increasingly turned against Israel’s war in Gaza. For the first time since Hamas’s Oct. 7 attack, a majority of Americans said in March that they disapproved of Israel’s military actions. Opposition to the war is most pronounced among Democrats, with 75 percent disapproving.

Sign up for Shifts, an illustrated newsletter series about the future of work
President Biden appears to share some of these misgivings; he has criticized Israel’s bombing campaign as “indiscriminate.” Reports of his conversations with Israeli Prime Minister Benjamin Netanyahu show a president at his wit’s end, irritated and even angry at his counterpart’s intransigence. But his criticisms have been made mostly in private settings, and there have been no major changes in policy. Biden has refused to put conditions on military aid to Israel. The Democratic Party leadership has largely followed suit.

The latest test in the relationship came in Saturday’s congressional vote on a stand-alone bill to provide Israel with billions of dollars in military assistance. This was the first time the House voted on a “clean” Israel bill that wasn’t bundled with Ukraine aid or poison pills such as funding cuts to the IRS. Thirty-seven of the 213 Democratic members of the House voted against the legislation. In one way, this was a lot. Voting against Israel aid was once exorbitantly risky; it no longer is. On the other hand, for a war as brutal and unpopular as this one, 37 seems like a low number.


No matter how you look at it, one conclusion is inescapable: There is a divide at the heart of the Democratic Party. Its standard-bearer, Joe Biden, finds himself at cross purposes with tens of millions of his own supporters.


Follow Shadi Hamid

Follow
In the days leading up to the vote, a group of Democratic members of Congress worked to marshal support for a “no” vote, in the hope that a strong showing might push Biden to reconsider his strategy. I spoke with four of them — Reps. Pramila Jayapal (Wash.), Ro Khanna (Calif.), Joaquin Castro (Tex.) and Becca Balint (Vt.). Castro called it “one of those defining votes about who we are as a nation.” Jayapal compared it with lopsided congressional votes in support of the Iraq and Afghanistan wars. “In the moment, it is very difficult to stop these wars and change policy,” she said, “and afterwards, we all say, oh, we shouldn’t have done that.” Each conveyed growing frustration but also a guarded optimism that the mainstream view was shifting in their favor. In a CBS News poll conducted earlier this month, only 32 percent of Democrats said the United States should send weapons and military supplies to Israel.

The “no” votes weren’t meant to express opposition to aid for Israel altogether. The problem, rather, is that the bill fails to put any conditions on that aid. It allows the secretary of state to waive “any congressional notification requirement applicable” to the $3.5 billion in foreign military financing grants — one of those peculiar provisions by which the legislative branch abdicates its own oversight powers. It also rewards the Netanyahu government with enhanced and exceptional privileges, enabling Israel to use the money to purchase arms from its own domestic industry as well as to buy U.S. weapons below “fair market value.”


One of the great puzzles of recent months has been the Biden administration’s refusal to use its considerable leverage with Israel. Conditioning aid to an ally is no small thing. But allies shouldn’t get a blank check to do whatever they want with American weapons. For months, Netanyahu has been resisting or ignoring Biden’s counsel on the need to drastically ramp up humanitarian aid, a matter made more urgent with Gaza on the brink of famine. Netanyahu’s postwar vision — one that calls for a large “buffer zone” and indefinite security operations in Gazan territory — is also dramatically at odds with America’s and, for that matter, everyone else’s.

For Americans, myself included, the question lingers: If we’re not willing to use our leverage now, is there any circumstance in which we would? Or should support for Israel, as opposed to other countries, be unconditional? As Jayapal put it, “It’s not just a matter of huffing and puffing.” Presumably, at some point, the Biden administration has to do something differently if it wants different results.

In my conversations with them, Jayapal, Khanna, Castro and Balint each emphasized the important distinction between providing defensive and offensive weapons to Israel. Their concern is the latter, the weapons of war that are used to destroy Gaza and kill Palestinian civilians in such large numbers. Of course, Israel, like any nation, has a right to defend itself. But this right is never unlimited or absolute. As Khanna noted, he has been a supporter of Israel’s Iron Dome air defense system and voted in the past for the $3.8 billion annual aid package to Israel. Balint, the first Jewish House member to come out in support of a cease-fire, describes herself as pro-Israel. “I have been a lifelong supporter of offensive and defensive measures for Israel to protect itself,” she said, “but there has to be a point at which we say, I am a supporter of Israel, I am the grandchild of someone who was murdered in the Holocaust, and I can also stand strong with what I believe are the majority of Americans.”


These arguments are compelling. But so far they have not been enough. Khanna, a rising star in the party, pointed to a “complete disconnect” between Washington and ordinary Democrats when it comes to Israel. There is, of course, something to be said for posterity, for setting a marker in moments when political courage is called for, however futile the cause. If rank-and-file Democrats continue to register their discontent in the months to come, the Biden administration might feel compelled to bend, not out of principle but for the more practical reason that a party leadership cannot afford to ignore its members on such a charged issue.


"
