Title,Date,Text
"In Egypt, one coup leads to another",7-12-2013,"It may be one of the most remarkable political rants ever caught on television. On the day before Egypt's coup, opposition activist Ehab al-Khouli launched into a vociferous diatribe when asked about Mohamed Morsi's last public speech as president.

“This ‘former’ president is addicted to his throne,” he screamed, gesturing wildly. “This man is a liar and a deceiver.” He gasped for breath and doubled over, coughing, as the talk show host pleaded with him to calm down. But he continued — beating the table, jumping out of his chair — for nearly four minutes.

Al-Khouli, in rather stark form, captured the anger and frustration of the millions of Egyptians who took to the streets on June 30. For many, democracy was not simply a matter of faith, or even of principle, but a means to something else: a sense of dignity, the promise of economic benefit, or the freedom to dress and think as they wish. Their sense that democracy had failed to bring real gains set in motion the breakdown of political order, the return of the generals and the overthrow of Egypt’s first democratically elected president.


The problem with coups is that, far from resolving conflicts, they threaten to exacerbate them. Soon after Morsi was ousted, the Egyptian military shut down several Islamist television stations and ordered the arrests of hundreds of Muslim Brotherhood members. The repression escalated this past week, with soldiers gunning down more than 50 Morsi supporters and the new military-appointed president issuing a constitutional decree granting himself nearly unlimited power.


Follow Shadi Hamid

Follow
Although a six-month timeline has been set for elections, these events paint a dark picture of what’s to come. With the country divided over the legitimacy of its leaders, repression is almost inevitable as a way to enforce the new order.

There is little doubt that Morsi was an incredibly disappointing president, narrow in vision and incompetent in execution. He should have realized that the greatest threat to a young democracy comes from those who believe they have no stake in the political system. These are the spoilers and they must be brought in. This requires magnanimity. Even if you are “right” — even if you win five successive elections, as the Muslim Brotherhood did — you can, and should, offer more concessions. And, to the extent possible, you should mean it.


Yet, under Morsi, a political process was in place that at least allowed the opposition to challenge his decisions, win a plurality in parliamentary elections and perhaps even form a government. In other words, there was the possibility of change from within the system.

Whether that possibility exists today is very much in doubt. One part of the country considers Adly Mansour the legitimate head of state while another considers Morsi the rightful president. The coup and subsequent crackdown have pushed millions of Morsi supporters outside the political order. It will be difficult for them to participate in a process they do not acknowledge. Yes, democracy is more than the ballot box. But the turmoil in Egypt underlines the importance of taking elections more seriously as the foundation of a democratic order.

If all it takes are massive crowds in the streets to bring down an elected leader, the very notion of democratic legitimacy will find itself under attack by a permanent revolution of sorts. As one Morsi partisan reasoned just a day before the coup, ""It's fine. If [Morsi] goes down, we'll bring down the president they elect.""

Advertisement

This is in a way its own crude form of democracy, with voting booths replaced by city squares and wide boulevards, and the act of counting votes replaced by the sheer mass of bodies. Political competition is reduced to a war of crowds and, inevitably, inflated protest counts. The 33 million cited by anti-Morsi protesters is not just a product of over-exuberance and a lack of spatial perception, but represents a pure, unmediated populism that appropriates “the people,” and their will, for ultimately divisive ends.

The case for procedural democracy may sound boring and staid. It is not the stuff of political fashion. I remember seeing my Egyptian and Tunisian friends voting for the first time in 2011, showing off stained index fingers. It felt good, but it could not compare to the rush of revolt. It was perhaps the historian Eric Hobsbawm who captured the feeling most colorfully. ""Next to sex,"" he wrote in his 2002 autobiography, ""the activity combining bodily experience and intense emotion to the highest degree is the participation in a mass demonstration at a time of great public exaltation.""

There is little glamour to be had in following electoral procedures, building political parties and organizing voters who may have lost faith in politicians. But all of these things are essential, and without them there is no real way to practice politics.

If and when Egypt has another round of free, fair and inclusive elections, the outcome will need to be respected rather than discarded as it was in the five successive polls over the course of 2011 and 2012. Democracy, at its very essence, is not about winning — anyone can do that — but learning how to lose."
"In Egypt, trying to reaffirm faith in their revolution",11-25-2011,"As Tahrir Square was beginning to erupt this past Sunday, I was talking with a parliamentary candidate affiliated with the Muslim Brotherhood's new political party. For nearly two hours, in a cafe in the posh Cairo neighborhood of Zamalek, we discussed the elections slated for this Monday, Egypt's first since the fall of President Hosni Mubarak in February. He explained the Muslim Brotherhood's get-out-the-vote strategy and his own campaign activities. Tahrir did not come up once.

Just a few days later, Egypt was transformed.

The renewed unrest started last Saturday, when the military, for reasons that remain unclear, decided to forcefully disperse a small group of peaceful protesters encamped in the square. For a growing number of politicized Egyptians, the ruling military council, initially lauded for forcing Mubarak out, has become the reviled symbol of a revolution gone awry. It had woefully mismanaged the transition, falling back on the autocratic ways of the past. The appointment Friday of 78-year-old Kamal el-Ganzouri as prime minister did little to change that view.


As the protests intensified, Cairo seemed to contain two distinct worlds operating in parallel: the world of Western-style campaigning, with microtargeting, door-to-door meet-and-greets and mass rallies, and the world of adamant, angry street protests. They had similar goals — the end of military rule, for example — but very different ideas of how to achieve them.


Follow Shadi Hamid

Follow
These protests, with fierce street battles and more than 40 killed, felt different from the ""first revolution"" earlier this year. They didn't seem to be political, in the normal sense of the word. At first there weren't clear political demands. Many of the protesters went to the square in large part to defend it against the brutality of the security forces. In this respect, the demonstrations were about solidarity as much as a desire to oust the ruling military council. Other protesters, meanwhile, were there for spiritual reasons, to recapture something, a feeling perhaps, that had been lost since those euphoric days in January and February.

A year ago, the nation witnessed its most fraudulent elections in history, with the ruling National Democratic Party winning 209 out of 211 seats in the first round. Less than two months later, Egypt had its revolt. Ordinary Egyptians no longer felt like waiting. They had lost faith in what was left of a discredited political process.


Nine months later, this same loss of faith is evident among the crowds in Tahrir. They do not trust the political parties — in fact, they have prevented numerous politicians from entering the square, shouting them down when they tried. Many simply don’t believe that the revolution’s goals can be achieved through the ballot box. In the elections scheduled for Monday, “revolutionary” candidates are likely to win only a small percentage of the vote, if they even manage to clear the parliamentary threshold.

Meanwhile, the Muslim Brotherhood, after more than 80 years, remains Egypt’s largest and most powerful political movement. It is almost certain to win a sizable plurality in the elections. For all the talk of its violent past and ideological rigidity, the Brotherhood is thoroughly — and, for many of its younger members, disappointingly — pragmatic. Its gospel is patience and discipline, something it learned the hard way in the prisons of President Gamal Abdel Nasser. The Brotherhood refers to this period as the mihna, or inquisition. It actively supported Nasser’s 1952 “revolution” — really just a military coup — but he quickly turned against the Brotherhood, banning the organization, and imprisoning and even executing many of its leaders.

From 2006 until the eve of Egypt’s revolution, Islamists were being crushed by the Mubarak regime, bringing back memories of the mihna. Yet, oddly, they didn’t seem angry. Muslim Brotherhood leaders would often tell me in calm, confident tones: “We aren’t in a rush. It’s a matter of time.”


The Brotherhood, along with nearly all of the country’s political elites, believed for decades that change was possible through the political process, however flawed. Sure, Egypt had an authoritarian regime, but the repression was never total. Through influential professional associations and the parliament, the Brotherhood, along with various liberal and leftist parties, hoped to effect gradual but meaningful change.

This model, however, failed. Revolution, something that no one had really thought possible, somehow came to Cairo, fueled by Tunisia's spontaneous uprising the month before.

It is ironic that in the new Egypt, the Brotherhood and its Freedom and Justice Party are the ones who speak the language of politics. Driven by the fading but still-powerful memories of the Jan. 25 revolution, it is the masses of Tahrir who speak the language of faith — faith in an ideal that may be well out of reach.


This contrast raises the question: What was Egypt’s revolution actually about? For some, it was about freedom and democracy. Once there was a democratic process, Egyptians could work through elected representatives to bring about social and economic change. This change, by its very nature, would be slow and uneven.

For others, probably the majority, Egypt’s revolution was also about a word — “dignity” — that is even more powerful in Arabic. When Egyptians use the word “karama,” there is something almost mystical about it. All the humiliation they’ve suffered, and all the hopes they manage to hold on to, fall under karama. In a revolution about dignity, though, tangible results are hard to come by and even harder to measure.

Through their actions in Tahrir Square this past week — in the pitched battles with security forces, in facing down tear gas and live ammunition — the protesters have defended their dignity and, in the process, reaffirmed the ideals of the revolution. The legitimacy of their ongoing uprising, which is far from complete, doesn’t come from an elected parliament of notables and politicians, but from the street. In this respect, the Egyptian and Arab revolutions of the past year have more in common with the Occupy Wall Street movement and like-minded protests in Greece and Italy than they do with, for example, the revolutions that spread through Eastern Europe nearly a decade ago.


On Tuesday morning, before the Tahrir crowds swelled into the tens of thousands, I sat down with Dina Zakaria, a leading member of the Brotherhood’s Freedom and Justice Party. I immediately brought up Tahrir; as many as 30 people had died by then. She had a pained look on her face, and I could tell she was struggling with the Brotherhood’s decision not to join the protesters. “I thought to myself, how can we abandon the people in the square?” she said. “I can’t bear to see people still being killed.”

She continued: “But at the same time, does this movement stay in the street, or should it be expressed through institutions? I think the right choice is through institutions.”

For decades, Egypt’s Islamists tried to work within the confines of the old regime. Patience and pragmatism might make for good politics, but, on the eve of Egypt’s landmark elections, it is an open question whether they’re good for the country’s stillborn democracy.

Advertisement

After a week of polarization, unrest and bloodshed, that question is even more difficult to answer. I had come to Egypt to write about the country’s first elections after the revolution. On Friday, while protesters were gathering peacefully in Tahrir, I visited a pro-military rally in the district of Abbassiya. I tried to engage the demonstrators in conversation, but several participants, suspicious of my American-accented Arabic, wondered aloud if I might be a spy. I was soon shouted down and ushered out of the area.

The cabdriver who picked me up was of the same mind. As we talked politics, he asked me where I was from and seemed suspicious. Suddenly, as we passed the Zamalek police station, he stopped the car, grabbed me and told the guards that I was up to no good. My cabdriver was attempting a citizen’s arrest. Fortunately, it failed. But the driver had wanted to take things into his own hands. He, too, had little patience for institutions. The street, it appears, has its own logic.

"
"Sometimes, Consensus Can Be Ruinous",3-18-2023,"The U.S. invasion of Iraq was the most consequential political event of the past two decades. But it doesn’t feel that way. It has the faint whiff of youthful indiscretion, an episode that many Americans would rather forget. I was 19. The tenor of that time in American life—after the September 11 attacks—seems ever more foreign to me. Instead of the chaotic information overload of the current moment, in which consensus appears impossible, the early 2000s were a time of conformity, authority, and security. When I think about why even the mere idea of consensus makes me anxious to this day, I keep coming back to what happened 20 long years ago. Consensus can be nice, but it can also be dangerous.
Once American ground troops were engaged in Afghanistan, risking their lives fighting the Taliban, any criticism of the war effort invited charges of disloyalty. That was the “good war.” I was a freshman in college on 9/11. Just a year later, in the lead-up to the Iraq invasion, I became active in the anti-war movement. Grappling with my own identity as an American Muslim in an environment rife with Islamophobia, I wanted somewhere to belong—a safe space, so to speak. And I found it. For the first and probably last time, I organized a die-in. I also helped organize a “tent-in” with a group of friends and fellow travelers, a motley crew of socialists, anarchists, and ordinary students who found themselves stupefied by a war that seemed self-evidently absurd. In the weeks before the war began—and then for the entire duration of the invasion—we protested by setting up camp in Georgetown University’s free-expression zone, the ironically named Red Square. In practice, at least one person was expected to sleep in the tents on any given night, which translated into a continuous presence of more than 2,000 hours.
David Frum: The Iraq War reconsidered
We failed. Obviously, we were just college students, naive and not yet cynical. But there were many of us. On February 15 and 16, 2003—a weekend of coordinated anti-war demonstrations around the globe—more than 6 million people filled the streets in hundreds of cities. As Patrick Tyler put it in The New York Times, “There may still be two superpowers on the planet: the United States and world public opinion.” It was an odd thought, that the people, united, could stop a terrible thing from happening.
When President George W. Bush infamously declared in May 2003—less than a month after Baghdad fell to U.S. forces—that the mission had been accomplished, an extended period of confusion and reckoning set in. After the apathy and triumphalism ushered in by the Cold War’s end, mass mobilization was back. But what was the point of people power if government officials couldn’t be bothered to listen? They had already decided. A relatively small number of so-called neoconservatives, many of whom had run in the same rarified intellectual circles, were committed to a marriage of overwhelming power and maximalist purpose. As the Lebanese American scholar Fouad Ajami described it:
A reforming zeal must thus be loaded up with the baggage and the gear. No great apologies ought to be made for America’s “unilateralism.” The region can live with and use that unilateralism. The considerable power now at America’s disposal can be used by one and all as a justification for going along with American goals.
Like most utopians, they may have been well-meaning in their fervor. A true believer himself, George W. Bush had admirable views about democracy’s universality, for which he deserves some credit. He excoriated critics for suggesting that Arabs weren’t ready for democracy; this was nothing more than “cultural condescension,” he said. He was right. In a November 2003 speech marking the 20th anniversary of the National Endowment for Democracy, he asked, “Are millions of men and women and children condemned by history or culture to live in despotism? Are they alone never to know freedom, and never even to have a choice in the matter? I, for one, do not believe it.”
But the stated justification for invading Iraq was not that Saddam Hussein was a dictator. After all, America’s closest allies in the region were dictatorships too. As senior administration officials told the United Nations and Congress, military action was necessary because Saddam’s regime had weapons of mass destruction and was therefore a mortal threat to the Middle East. Others who might have otherwise been skeptical about the indiscriminate use of American power—including prominent Democrats such as John Kerry and Hillary Clinton—fell in line. In October 2002, 39 percent of Democrats in the House supported the Authorization for Use of Military Force Against Iraq Resolution. Remarkably, 58 percent of Senate Democrats voted in favor. It was the worst and perhaps most tragic example of “bipartisan cooperation” in recent American history.
Their hearts weren’t necessarily in it, but Senate Democrats were an ambitious bunch. For anyone who aspired to higher office, being on the wrong side of the right war was a risky proposition. With the wounds of September 11 still smarting, vengeance was in the air. In mainstream media outlets, passionate anti-war voices—before the war, rather than after—were difficult to find. I mostly got my daily dose of anti-war news and coverage from small leftist websites. I even wrote for one such publication: It was (and still is) called CounterPunch, a wholly appropriate description of both the futility and pluckiness of the endeavor.
A sizable minority of Americans had their reservations about this new culture of patriotic deference, but they were on the defensive from the very start. The post-9/11 consensus was a tragedy upon a tragedy, exemplified by a 98–1 Senate vote for the PATRIOT Act just 44 days after the attacks. “National unity” is usually an aspiration not met. Here, it seemed within reach.
Melvyn P. Leffler: What really took America to war in Iraq
This was bipartisan cooperation at its best but also its worst. At more than 130 pages, the PATRIOT Act—a suitably Orwellian acronym for “Providing Appropriate Tools Required to Intercept and Obstruct Terrorism”—ushered in a perpetually overreaching national-security state and a litany of civil-rights abuses that disproportionately affected Arab and Muslim communities. As the ACLU described it, “While most Americans think it was created to catch terrorists, the Patriot Act actually turns regular citizens into suspects.” Under an expansive surveillance regime, the FBI issued about 192,000 “national security letters” from 2003 to 2006, which allowed it to access the private information of American citizens without a warrant.
This is what unity, consensus, and cooperation made possible in the fog of war. For those Americans today who lament polarization and long for a return to the politics of consensus, be careful what you wish for. In 2001, within a sprawling, unwieldy democracy of 285 million people, what could “consensus” even mean? As the Belgian political theorist Chantal Mouffe has written, “All forms of consensus are by necessity based on acts of exclusion.” The post-9/11 consensus was artificial, guided and reinforced from above. It was also fleeting. When the Bush administration’s hold on the public imagination weakened, Americans returned to their natural boisterousness and distrust of politicians and institutions alike. This is a good thing.
When it comes to wars of choice—which is to say, most wars—Americans should disagree among themselves, and they should express those disagreements forcefully. A democratized news landscape, like democracy itself, can be messy. But that messiness is essential. A certain kind of chaos is precisely what allows for a vibrant exchange of contending and conflicting views. In a democracy, the majority still rules. At the same time, embattled minorities need avenues—and encouragement—to register their dissent, in the hope of convincing enough of their fellow citizens that they are right. Because sometimes they are. And the Iraq War was one of those times.
"
