Title,Date,Text
American Self-Criticism Borders on Narcissism,1-9-2020,"Those who said there will be war may not have realized there already was war. This doesn’t mean killing Iranian General Qassem Soleimani was good. It almost certainly wasn’t. Iran quickly retaliated by targeting two American military bases in Iraq and may find new ways to escalate, but Iran had already been escalating. The regime of the Syrian dictator Bashar al-Assad, with its Iranian patrons, led by Soleimani, has been waging a brutal assault on Syrians for more than eight years. War, in short, has been happening—costing hundreds of thousands of Syrian civilians their lives—since long before Donald Trump ordered the drone strike against Soleimani.
In the aftermath of the strike, critics of the Trump administration’s foreign policy, particularly on the left, have described the move as one more rash American intervention that’s sure to further destabilize the region. Yet this formulation gives U.S. policy, for all its flaws, too much credit. Not everything is America’s fault; others are sometimes to blame; and no one, not even the weaker parties, are devoid of agency or freed of responsibility. The burden of de-escalation does not fall entirely on the United States; Iran, too, can choose to de-escalate.
More by Shadi Hamid
An illustration of a raised fist overset with stamped outlines of viruses
The Coronavirus Killed the Revolution
Shadi Hamid
Xi Jinping at the School of Medicine at Tsinghua University in Beijing
China Is Avoiding Blame by Trolling the World
Shadi Hamid
President Donald Trump
Impeachment Could End Badly
Shadi Hamid
There is also the problem of Trump himself. Because killing Soleimani was very much his decision—reflecting the impulsiveness and disarray a decision by him implies—it seems fair to assume that one’s view of the president will affect how one interprets the fallout from Soleimani’s killing. Correcting for subconscious bias isn’t easy, but at the very least, observers should be aware of the Trump effect.
Middle East experts, and particularly those from the region, have tended to be less alarmist than most other commentators. These experts are likely to be less fixated on Trump himself and less likely to put the United States at the center of their analysis. And they are more likely to be aware of the sheer scale of brutality, mass murder, and sectarian cleansing that Soleimani helped orchestrate. Soleimani wasn’t just another bad guy. He was one of the region’s worst. (Yet another humanitarian catastrophe has been unfolding in Syria, but it has garnered little attention. The Assad regime, with crucial military support from Iran and Russia, has been bombing Idlib province. More than 200,000 Syrians have already fled, and hundreds of thousands more could be forced from their homes.)
It is not an overstatement to say that Qassem Soleimani “haunted” the Arab world. As Kim Ghattas wrote here in The Atlantic, “Soleimani was so central to almost every regional event in the past two decades that even people who hate him can’t believe he could die.” It is a rich irony that as Democrats portrayed the strike as one of the worst foreign-policy blunders of the Trump presidency, a significant number of Syrians and Iraqis rejoiced—one of the very few times they have reacted positively to something, anything, that the United States has done. Their interests, of course, are not the same as Americans’, but there should at the very least be an effort to understand why they might have celebrated.
[Read: Qassem Soleimani haunted the Arab world]
In trying to process and respond to Soleimani’s killing, the left finds itself in a bind, torn between two competing impulses. The first impulse combines an opposition to Western imperialism with a justified skepticism toward the use of U.S. military force. Human beings desire, or perhaps even need, moral clarity. Considering America’s destructive record in the Middle East, it is easy to assume that we are the problem, particularly when the resort to military action is buttressed by murky legal rationales. The second impulse is the left’s long-standing tradition of solidarity with the victims of repression and with populations rather than the regimes that subjugate them. In the unique context of Soleimani and the Iranian regime, this second concern comes into direct conflict with the first.
It’s impossible to resolve this tension, and the best one can hope for is that it be marshaled in the service of creative policy ideas. Still, too much of the analysis on the left seems to have erred on the side of anti-imperialist critique with insufficient attention to what Iran has actually been doing for years—at tremendous human cost to Syrians and to other civilian populations in the region. It is understandably difficult to view the Iranian regime as an aggressor when it has found itself in the sights of the world’s most powerful country, which has unparalleled military projection and the largest military budget of any state in human history.
America’s story in the Middle East is a tragic one, animated by a series of “original” sins. One can start history at the 2003 Iraq War, or one can begin earlier, with the first Bush administration encouraging Shias and Kurds to rise up en masse against Saddam Hussein after the Gulf War in 1991, only to turn its back on them as they marched toward Baghdad. Saddam remained in power, and as many as 100,000 Iraqis fell victim to reprisal killings, many of which “were committed in proximity to American troops, who were under orders not to intervene.”
Or one can look still further into the past. In Iran from the 1950s through the ’70s, the United States supported the brutal repression of dissenters by the shah, Mohammed Reza Pahlavi. He was “our S.O.B.,” to borrow Franklin D. Roosevelt’s famous description of a different American-backed authoritarian. But before that, in 1953, Americans helped organize the overthrow of the democratically elected prime minister, Mohammed Mossadegh, which facilitated the conditions for the shah’s bid for absolute control; the shah’s excesses, in turn, are what made the Iranian revolution possible.
Even good things, like the notion that the United States should back dictatorships less and promote democracy more, have been tainted in the eyes of the left (and, for that matter, the right) by the second Bush administration’s rhetorical embrace of democracy promotion and the “freedom agenda.” But this is where U.S.-centrism becomes a blind spot. Not everything is about us. And not everything is primarily a question of whether the United States is using military force. Not every new crisis is about repeating the blunders of the Iraq War. Syria most certainly isn’t, and wasn’t, Iraq, and thinking that it is had a distorting effect on the Obama’s administration’s policy, with tragic consequences.  
[David A. Graham: Trump is no closer to solving America’s Iran problem]
The United States has done terrible things in the Middle East. To even casual observers of the region, this should be clear enough. That, however, doesn’t mean there is a moral equivalence between Iran and the United States. Elevating America as a somehow unique source of evil takes necessary self-criticism and turns it into narcissism. It insists on making us the exceptional ones, glorifying ourselves by glorifying our sins. To suggest that American officials are at the rarefied level of the deliberate, systematic mass murder and sectarian cleansing that Soleimani helped orchestrate isn’t just wrong; it’s silly.
Despite the blood on his hands, 1 million or more Iranians publicly mourned Soleimani’s death. Some commentators took this as evidence that Iranians, despite their differences, were uniting in solidarity with their slain hero. Already, it appeared, the United States was losing. The large crowd sizes were an odd thing for critics of the Trump administration to highlight, though; in the absence of additional context, the mass mourning of a ruthless killer could only have the effect of making the Iranian people look bad. But demonstrations, particularly in a dictatorship, aren’t exactly an accurate bellwether of public sentiment (that’s what elections are for). Iran has a population of more than 80 million. That about 1 million were protesting tells us that some people revered Soleimani or at least felt some instinctual nationalist attachment to him, but it doesn’t tell us much more than that.
To focus on the perceived victims of American might and aggression—and many ordinary Iranians no doubt have suffered from punishing sanctions—runs the risk of imputing moral superiority to the mere act of resistance to the United States. But suffering, or to resisting, is not quite the same as being right. The Iranian regime, and Soleimani first and foremost, have long demonstrated that the weaker party does, in fact, have agency and that the powerless can use their power to destructive effect."
Impeachment Could End Badly,12-16-2020,"I don’t have the courage of my convictions. President Donald Trump deserves to be impeached for trying to pressure Ukraine to investigate his political opponents. With every week, he says or does something worse than what he already said or did. But to say Trump deserves impeachment is different from saying that impeachment is good for the country. It might, in fact, turn out quite badly.
Most of the people whom I like or trust believe—and believe rather strongly—that what Trump has done rises to a crime. For them, the analysis of whether Trump should be impeached can’t help but be informed by their view that Trump represents an existential threat to the country. If he might damage American democracy at some fundamental level, without any obvious recourse, then pursuing his removal from office would seem to go without saying. That he is in a position to win again in 2020 and serve another four years makes impeachment all the more urgent.
Yet if you believe, as I do, that Trump is bad, but also that his badness falls somewhat short of an existential threat, then impeachment, however justified in theory, becomes less straightforward. The process does not unfold in a political vacuum, and Democrats should not let the certainty of their legal reasoning push them toward impeachment without regard for its real-world consequences—which are uncertain and could prove costly. Impeachment also runs the risk of hijacking the debate in the Democratic primary, as well as further embittering Trump’s supporters and souring them on the democratic process.
More by Shadi Hamid
A man walks down a street holding an ISIS flag and a gun in Raqqa.
What America Never Understood About ISIS
Shadi Hamid
A boy whose family is seeking asylum
Europeans Don’t Necessarily Share American Values
Shadi Hamid
Mohamed Morsi in 2012
The Tragedy of Egypt's Mohamed Morsi
Shadi Hamid
Ultimately, the decision to impeach is a matter of judgment, not so much a question of whether Trump committed high crimes and misdemeanors (he almost certainly did) as whether invoking the Constitution’s impeachment provision right now is a good idea.
The now-infamous Ukraine quid pro quo might be obviously worse than what came before, but it is still only the latest in a long series of impeachable offenses. In April 2017, the American University professor Allan Lichtman published The Case for Impeachment, which made its case based on a “deep analysis of Trump’s past and proven behavior.” Considering that the book came in at 300 pages, presumably there was a lot of material (and that was just a few months into Trump’s term, before he had a chance to do much of anything as president). In a September 2017 review of books about impeachment, the law professor Noah Feldman and journalist Jacob Weisberg argued that Lichtman had overreached, but they identified other plausible reasons to impeach the 45th president. “What might constitutionally grounded articles of impeachment against Donald Trump look like? The most clear-cut one,” Feldman and Weisberg wrote, “would be based on public corruption, including conflicts of interest and receipt of foreign emoluments.”
[Read: Impeachment’s inevitability problem]
Every Democratic politician is asking—and should ask: Is impeachment at this moment a good idea politically, and, related but probably less important for politicians, is it a good idea for the country? Presumably, many of them decided finally that, with the Ukraine fiasco, it was a good, or at least an unavoidable, idea politically. To do nothing would be to shrug their shoulders in the face of one of the most corrupt presidents in modern history. Impeachment is, after all, in the Constitution, and if not now, when? A minority of House Democrats may have had doubts but had little choice to go along with it. This being a democracy, they have to be responsive to the people who actually voted for them, and the majority of Democrats support impeachment.
But will impeachment be good for Democrats in 2020 and beyond? On a purely tactical level, it is unlikely that any of this will erode Trump’s support. It has been more than two months since House Speaker Nancy Pelosi initiated the impeachment inquiry, on September 24, yet polling averages have remained as they have always been: immovable, a testament to the growing inelasticity of American politics. What parties or politicians do, or don’t do, has limited bearing on what people—most of whom have already made up their minds—think of them. When Trump made his notorious comment that he could shoot someone in the middle of Fifth Avenue and not lose any voters, he was describing a country in which his supporters’ views are perfectly inelastic.
Even if impeachment proceedings fail to change any minds, they will still have consequences on the overall dynamics of the 2020 election. For one, they threaten to consume public debate and pull the various Democratic candidates in the direction of endlessly commenting on or responding to Donald Trump. Whether this would be to Democrats’ benefit is debatable; focusing on what’s wrong with Trump at the expense of building an inspiring, affirmative case for the presidency didn’t quite work well last time around.
More substantively, a full-blown impeachment trial distracts Democrats from their natural strengths: channeling Americans’ anger against massive inequality and economic injustice and moving Americans toward what I’ve described as the “economics of meaning,” in which economic or class critiques are a means to focus anger, create meaning, and build solidarity. Joe Biden may have based his candidacy on not being Trump, but the other top-tier candidates—Bernie Sanders, Elizabeth Warren, and Pete Buttigieg—have all based their candidacies on something more than mere opposition to the incumbent. They have an interest in keeping it that way. As Ari Berman writes, “One of the biggest divides in the race for the Democratic presidential nomination is whether Donald Trump is a cause or a symptom of the current dysfunction in American politics.” To focus on impeachment, then, is to focus on the symptom.
Then there’s the question of whether impeachment is “good” on its own terms. It is nearly impossible to imagine how Trump could actually be convicted by the Senate and therefore removed from office, but this doesn’t change the fact that the ostensible goal of impeachment is to remove him—and to erase what, for many Democrats, has been since November 2016 an unacceptable reality. The desire to remove Trump from office cannot be separated from the decision to pursue impeachment, so it is worth considering, even as a thought exercise, what removal would actually mean.
[Mario Loyola: Democrats have failed to prove their case against Trump]
As I have argued elsewhere, the removal of Trump, however legally and constitutionally legitimate, would confirm the worst suspicions of his supporters: that their voices, in the end, wouldn’t be allowed to count. Their democratic and electoral agency would be denied. In Britain, there was a palpable anger among Brexiteers that what they’d won at the polls in the 2016 referendum would be taken away from them with calls for a do-over vote. Similarly, a sense of disenfranchisement would sour tens of millions of Americans on the democratic process—and on the idea of democracy. The perception that a legitimate electoral outcome was undone by those other than the voters themselves—in this case partisan actors and political elites—could inflict the very damage on the system’s democratic legitimacy that Democrats themselves have been warning against. Already, as the political theorist Nathan Pippenger writes, “public debate seems driven by an urge to deny the legitimacy of one’s ideological opponents.” How do we reduce—or at least not exacerbate—these “legitimacy” risks?
Some of these legitimacy risks, albeit on a (hopefully) more manageable level, would be present in either of two possible scenarios short of removal: impeachment without removal, followed by a Trump victory in 2020, or impeachment without removal, followed by a Trump defeat. A prolonged impeachment process, even if it has nothing to do with Trump’s loss, could taint an otherwise clean Democratic victory, particularly if the numbers are close. Some Republican voters will, of course, treat any Democratic victory as illegitimate, but there’s no reason to give them additional arguments to use in their favor. If Trump wins, he will be the first president to serve a new term after having been impeached the previous term. This would, in the minds of Democratic voters, make him seem even more illegitimate than he already was and further undermine their perceptions of the democratic process. Democrats will rightly ask how it is that their fellow Americans could reelect—after everything they know—a president both disgraced and impeached. In impeaching Trump, House Democrats are posing a question whose answer they do not want to hear.
And this is why I’m torn. Democrats had to do something. The president has been wrong and done wrong, and his misdeeds must be recorded somehow. There is something to be said for upholding basic constitutional principles, irrespective of outcome, especially when future scenarios can comfortably remain in the realm of the imagined. Or more fatalistically, as the Atlantic Council’s Faysal Itani put it: “Maybe sometimes you gotta do something even if it’s a bad idea.” Democrats have probably made the right choice. It’s just a choice Americans may have to pay for.
"
